id,submitter,categories,abstract,title,affiliation
28,Alberto Verjovsky,math.AG math.CV,"  We present a proof of Chow's theorem using two results of Errett Bishop
retated to volumes and limits of analytic varieties. We think this approach
suggested a long time ago in the beautiful book by Gabriel Stolzenberg, is very
attractive and easier for students and newcomers to understand, also the theory
presented here is linked to areas of mathematics that are not usually
associated with Chow's theorem. Furthermore, Bishop's results imply both Chow's
and Remmert-Stein's theorems directly, meaning that this approach is more
economic and just as profound as Remmert-Stein's proof. At the end of the paper
there is a comparison table that explains how Bishop's theorems generalize to
several complex variables classical results of one complex variable.
",Chow's Theorem Revisited,National Autonomous University of Mexico
29,Alberto Verjovsky,math.GT math.MG,"  The $n$-skeleton of the canonical cubulation $\cal C$ of $\mathbb{R}^{n+2}$
into unit cubes is called the {\it canonical scaffolding} ${\cal{S}}$. In this
paper, we prove that any smooth, compact, closed, $n$-dimensional submanifold
of $\mathbb{R}^{n+2}$ with trivial normal bundle can be continuously isotoped
by an ambient isotopy to a cubic submanifold contained in ${\cal{S}}$. In
particular, any smooth knot $\mathbb{S}^{n}\hookrightarrow\mathbb{R}^{n+2}$ can
be continuously isotoped to a knot contained in ${\cal{S}}$.
","Any smooth knot $\mathbb{S}^{n}\hookrightarrow\mathbb{R}^{n+2}$ is
  isotopic to a cubic knot contained in the canonical scaffolding of
  $\mathbb{R}^{n+2}$",National Autonomous University of Mexico
30,Alberto Verjovsky,math.CV,"  In this paper we present a series of seemingly unrelated results of Complex
Analysis which are in fact connected via a different approach to their proofs
using the results of Errett Bishop of volumes and limits of analytic varieties.
We start by proving Chow's theorem by a technique suggested long time ago in
the beautiful book by Gabriel Stolzenberg. We think this approach is very
attractive and easier for students and newcomers to understand; also the theory
presented here is linked to areas of mathematics that are not usually
associated with Chow's result. In addition, Bishop's results imply both Chow's
and Remmert-Stein's theorems directly, meaning that this view is simpler and
just as profound as Remmert-Stein's proof. After that, we give a comparison
table that explains how Bishop's theorems generalize to several complex
variables classical results of one complex variable and prove Montel's
compactness theorem using the techniques presented here. Finally we give an
alternative proof of a theorem of Edwards, Millet and Sullivan of foliations
with compact leaves for the case of complex foliations in K\""ahler manifolds.
","Errett Bishop theorems on Complex Analytic Sets: Chow's Theorem
  Revisited and Foliations with all leaves Compact on K\""ahler Manifolds",National Autonomous University of Mexico
31,Alberto Verjovsky,math.GT math.DS,"  In this paper we construct infinitely many wild knots,
$\mathbb{S}^{n}\hookrightarrow\mathbb{S}^{n+2}$, for $n=2,3,4$ and 5, each of
which is a limit set of a geometrically finite Kleinian group. We also describe
some of their properties
",Wild knots in higher dimensions as limit sets of Kleinian groups,National Autonomous University of Mexico
32,Alberto Verjovsky,math.DG math.CV math.GT,"  In this paper we survey $n$-dimensional solenoidal manifolds for $n=1,2$ and
3, and present new results about them. Solenoidal manifolds of dimension $n$
are metric spaces locally modeled on the product of a Cantor set and an open
$n$-dimensional disk. Therefore, they can be ""laminated"" (or ""foliated"") by
$n$-dimensional leaves. By a theorem of A. Clark and S. Hurder, topologically
homogeneous, compact solenoidal manifolds are McCord solenoids i.e. are
obtained as the inverse limit of an increasing tower of finite, regular covers
of a compact manifold with an infinite and residually finite fundamental group.
In this case their structure is very rich since they are principal Cantor-group
bundles over a compact manifold and they behave like ""laminated"" versions of
compact manifolds, thus they share many of their properties. These objects
codify the commensurability properties of manifolds.
",Low-dimensional solenoidal manifolds,National Autonomous University of Mexico
33,Alberto Verjovsky,math.SG math.GT,"  We construct a smooth codimension-one foliation on the five-sphere in which
every leaf is a symplectic four-manifold and such that the symplectic structure
varies smoothly. Our construction implies the existence of a complete regular
Poisson structure on the five-sphere.
","A smooth codimension-one foliation of the five-sphere by symplectic
  leaves",National Autonomous University of Mexico
34,Alberto Verjovsky,math.GT,"  We say that a topological $n$-manifold $N$ is a cubical $n$-manifold if it is
contained in the $n$-skeleton of the canonical cubulation $\mathcal{C}$ of
${\mathbb{R}}^{n+k}$ ($k\geq1$). In this paper, we prove that any closed,
oriented cubical $2$-manifold has a transverse field of 2-planes in the sense
of Whitehead and therefore it is smoothable by a small ambient isotopy.
",Smoothing closed gridded surfaces embedded in ${\mathbb R}^4$,National Autonomous University of Mexico
35,Alberto Verjovsky,math.DG math.AG,"  For $n \geq 1$, the twistor space $\mathfrak{Z}(\mathbb{S}^{2n})$ of the
conformal $2n$-sphere is biholomorphic to the Zariski closure, taken in the
complex Grassmannian manifold $\mathbf{G}(n+1, 2n+2)$, of the set of graphs of
skew-symmetric linear endomorphism of $\mathbb{C}^{n+1}$. We use this fact to
describe a natural stratification of the twistor space
$\mathfrak{Z}(\mathbb{S}^{2n})$ with $n \geq 3$, in terms of what we have
called {\it generalised complex orthogonal Stiefel manifolds} of
$\mathbb{C}^{n+1}$. In particular, the twistor space
$\mathfrak{Z}(\mathbb{S}^{6})$ is biholomorphic to a non-singular complex
quadric hypersurface in $\mathbb{P}^{7}$. We explicitly construct a
real-analytic foliation, by linear 3-folds, of this quadric hypersurface such
that the quotient space is isomorphic to the 6-sphere with its standard metric.
This foliation is Riemannian with respect to the Fubini-Study metric and
isometrically equivalent to the twistor fibration over the 6-sphere.
","Skew-symmetric complex matrices, pure spinors, the twistor space of the
  conformal $2n$-sphere, and the Fano variety of linear $n$-folds of a
  non-singular complex quadric hypersurface in $\mathbb{P}^{2n+1}$",National Autonomous University of Mexico
36,Alberto Verjovsky,math.GT,"  In this paper we study topological surfaces as gridded surfaces in the
2-dimensional scaffolding of cubic honeycombs in Euclidean and hyperbolic
spaces.
",Topological surfaces as gridded surfaces in geometrical spaces,National Autonomous University of Mexico
37,Alberto Verjovsky,math.DG math.AT,"  We study the space of deformations of a smooth foliation of the 5-sphere by
complex manifolds
","On the moduli space of certain smooth codimension one foliations of the
  5-sphere by complex surfaces",National Autonomous University of Mexico
38,Alberto Verjovsky,math.AT math.AG,"  In the context of orientable circuits and subcomplexes of these as
representing certain singular spaces, we consider characteristic class formulas
generalizing those classical results as seen for the Riemann-Hurwitz formula
for regulating the topology of branched covering maps and that for monoidal
transformations which include the standard blowing-up process. Here the results
are presented as cap product pairings, which will be elements of a suitable
homology theory, rather than characteristic numbers as would be the case when
taking Kronecker products once Poincar\'e duality is defined. We further
consider possible applications and examples including branched covering maps,
singular varieties involving virtual tangent bundles, the
Chern-Schwartz-MacPherson class, the homology L-class, generalized signature,
and the cohomology signature class.
","Homology theory formulas for generalized Riemann-Hurwitz and generalized
  monoidal transformations",National Autonomous University of Mexico
39,Alberto Verjovsky,math.GT,"  In this paper we prove that a wild knot $K$ which is the limit set of a
Kleinian group acting conformally on the unit 3-sphere, with its standard
metric, is homogeneous: given two points $p, q\in{K}$ there exists a
homeomorphism $f$ of the sphere such that $f(K)=K$ and $f(p)=q$. We also show
that if the wild knot is a fibered knot then we can choose an $f$ which
preserves the fibers.
",Homogeneity of dynamically defined wild knots,National Autonomous University of Mexico
40,Alberto Verjovsky,math.GT,"  In this paper, we prove that given two cubical links of dimension two in
${\mathbb R}^4$, they are isotopic if and only if one can pass from one to the
other by a finite sequence of cubulated moves. These moves are analogous to the
Reidemeister and Roseman moves for classical tame knots of dimension one and
two, respectively.
",Cubulated moves for 2-knots,National Autonomous University of Mexico
41,Alberto Verjovsky,math.CV,"  We generalize the Ahlfors-Bers theory to the adelic Riemann sphere. In
particular, after defining the appropriate notion of a Beltrami differential in
the solenoidal context, we give a sufficient condition on it such that the
corresponding Beltrami equation has a quasiconformal homeomorphism solution;
i.e. The Ahlfors-Bers Theorem in the solenoidal case. This additional condition
on the solenoidal Beltrami differentials can be written as a Banach norm in a
subspace of solenoidal differentials. Moreover, this subspace is the completion
under this norm of those solenoidal differentials locally constant at the
fiber. As a toy example, we show how this technique works on a linear problem:
We generalize the diophantine equation complex analytic extension problem to
the respective solenoidal space.
",Adelic solenoid II: Ahlfors-Bers theory,National Autonomous University of Mexico
42,Alberto Verjovsky,math.DS,"  Inspired by the works of Zagier, we study the probability measures $\nu(t)$
with support on the flat tori which are the compact orbits of the maximal
unipotent subgroup acting holomorphically on the positive orthonormal frame
bundle $\mathcal{F}({M}_D)$ of 3-dimensional hyperbolic Bianchi orbifolds
${M}_D=\mathbb{H}^3/\widetilde{\Gamma}_D$, of finite volume and with only one
cusp. Here $\Gamma_D=PSL(2, \mathcal{O})$, where $\mathcal{O}$ is the ring of
integers of an imaginary quadratic field of class number one.
","Eisenstein series and equidistribution of Lebesgue probability measures
  on compact leaves of the horocycle foliations of Bianchi 3-orbifolds",National Autonomous University of Mexico
43,Alberto Verjovsky,math.CV math.AG,"  In this paper, following Grothendieck {\it Esquisse d'un programme}, which
was motivated by Belyi's work, we study some properties of surfaces $X$ which
are triangulated by (possibly ideal) isometric equilateral triangles of one of
the spherical, euclidean or hyperbolic geometries. These surfaces have a
natural Riemannian metric with conic singularities. In the euclidean case we
analyze the closed geodesics and their lengths. Such surfaces can be given the
structure of a Riemann surface which, considered as algebraic curves, are
defined over $\bar{\mathbb{Q}}$ by a theorem of Belyi. They have been studied
by many authors of course. Here we define the notion of connected sum of two
Belyi functions and give some concrete examples. In the particular case when
$X$ is a torus, the triangulation leads to an elliptic curve and we define the
notion of a ""peel"" obtained from the triangulation (which is a metaphor of an
orange peel) and relate this peel with the modulus $\tau$ of the elliptic
curve. Many fascinating questions arise regarding the modularity of the
elliptic curve and the geometric aspects of the Taniyama-Shimura-Weil theory.
","Some remarks on equilateral triangulations of surfaces and Belyi
  functions",National Autonomous University of Mexico
44,Alberto Verjovsky,math.DS math.NT,"  Inspired by the work of Zagier, we study geometrically the probability
measures $m_y$ with support on the closed horocycles of the unit tangent bundle
$M=\text{PSL}(2,\mathbb{R})/\text{PSL}(2,\mathbb{Z})$ of the modular orbifold
$\text{PSL}(2,\mathbb Z)$. In fact, the canonical projection
$\mathfrak{p}:M\to\mathbb{H}/\text{PSL}(2,\mathbb Z)$ it is actually a Seifert
fibration over the orbifold with two especial circle fibers corresponding to
the two conical points of the modular orbifold. Zagier proved that $m_y$
converges to normalized Haar measure $m_o$ of $M$ as $y\to0$: for every smooth
function $f:M\to \mathbb R$ with compact support $m_y(f)=m_0(f)+o(y^\frac12)$
as $y\to0$. He also shows that
  $m_y(f)=m_0(f)+o(y^{\frac34-\epsilon})$ for all $\epsilon>0$ and smooth
function $f$ with compact support in $M$ if and only if the Riemann hypothesis
is true. In this paper we show that the exponent $\frac12$ is optimal if $f$ is
the characteristic function of certain open sets in $M$. This of course does
not imply that the Riemann hypothesis is false. It is required the
differentiability of the functions in the theorem.
","Arithmetic, geometry and dynamics in the unit tangent bundle of the
  modular orbifold",National Autonomous University of Mexico
45,Alberto Verjovsky,math.GT,"  In this paper, we prove than given two cubic knots $K_1$, $K_2$ in
$\mathbb{R}^3$, they are isotopic if and only if one can pass from one to the
other by a finite sequence of cubulated moves. These moves are analogous to the
Reidemeister moves for classical tame knots. We use the fact that a cubic knot
is determined by a cyclic permutation of contiguous vertices of the
$\mathbb{Z}^3$-lattice (with some restrictions), to describe some of the
classic invariants and properties of the knots in terms of such cyclic
permutations, by projecting onto a plane such that it is injective when
restricted to the $\mathbb{Z}^3$-lattice and the image of the
$\mathbb{Z}^3$-lattice is dense.
",Cubulated moves and discrete knots,National Autonomous University of Mexico
46,Alberto Verjovsky,math.CV,"  We construct an Ahlfors-Bers complex analytic model for the Teichm\""uller
space of the universal hyperbolic lamination (also known as Sullivan's
Teichm\""uller space) and the renormalized Weil-Petersson metric on it as an
extension of the usual one. In this setting, we prove that Sullivan's
Teichm\""uller space is K\""ahler isometric biholomorphic to the space of
continuous functions from the profinite completion of the fundamental group of
a compact Riemann surface of genus greater than or equal to two to the
Teichm\""uller space of this surface; i.e. We find natural K\""ahler coordinates
for the Sullivan's Teichm\""uller space. This is the main result. As a
corollary, we show the expected fact that the Nag-Verjovsky embedding is
transversal to the Sullivan's Teichm\""uller space contained in the universal
one.
","Teichm\""uller theory of the universal hyperbolic lamination",National Autonomous University of Mexico
47,Alberto Verjovsky,math.AT,"  We construct open book structures on moment-angle manifolds and give a new
construction of examples of contact manifolds in arbitrarily large dimensions.
","Open Book Structures on Moment-Angle Manifolds $Z^{\mathbb C}(\Lambda)$
  and Higher Dimensional Contact Manifolds",National Autonomous University of Mexico
48,Alberto Verjovsky,math.CV,"  These are notes for the CIME school on Complex non-K\""ahler geometry from
July 9th to July 13th of 2018 in Cetraro, Italy. It is an overview of different
properties of a class of non-K\""ahler compact complex manifolds called LVMB
manifolds, obtained as the Hausdorff space of leaves of systems of commuting
complex linear equations in an open set in complex projective space ${{mathbb
P}_{\mathbb C}}^{n-1}$
","Intersection of quadrics in ${\mathbb{C}}^n$, moment-angle manifolds,
  complex manifolds and convex polytopes",National Autonomous University of Mexico
49,Alberto Verjovsky,math.GT math.DS,"  In this paper we consider the Kleinian groups acting conformally on the
sphere $\mathbb{S}^{n+2}$ $(1\leq{n}\leq5)$ which have as limit sets wild
spheres $K^n$ which were constructed in \cite{BHV} and prove that $K^n$ is
ambient homogeneous. In other words, given two points $p,\,\,q\in{K}$ there
exists a homeomorphism $\psi:\mathbb{S}^{n+2}\rightarrow\mathbb{S}^{n+2} $ such
that $\psi(K)=K$ and $\psi(p)=q$.
","Some examples of dynamically defined ambient homogeneous wild knots in
  higher dimensions",National Autonomous University of Mexico
50,Alberto Verjovsky,math.SG math.AT,"  We construct new examples of contact manifolds in arbitrarily large
dimensions. These manifolds which we call quasi moment-angle manifolds, are
closely related to the classical moment-angle manifolds.
","Moment-angle manifolds, intersection of quadrics and higher dimensional
  contact manifolds",National Autonomous University of Mexico
51,Alberto Verjovsky,math.DS,"  This article presents a generalization of the notion of \emph{Poincar\'e
rotation set} to homeomorphisms of the ad\`ele class group
$\mathbb{A}/\mathbb{Q}$ of the rational numbers $\mathbb{Q}$, which is a
connected compact abelian group which can be identified with the
one-dimensional universal solenoid $\mathbf{S}$, \ie the algebraic universal
covering of the circle. The definition is first introduced in general for
homeomorphisms of $\mathbf{S}$ which are isotopic to a translation, and then
specializing in homeomorphisms of $\mathbf{S}$ isotopic to the identity, in
which case the rotation set is a closed interval contained in the base leaf
(the connected component of the identity). If in the latter case the rotation
interval reduces to a single element $\rho$ and $\rho$ is irrational (\ie it is
a monothetic generator of $\mathbf{S}$), we show that the homeomorphism is
semiconjugate to the translation $z\mapsto\rho{z}$, like in the classical
theory of Poincar\'e. This theory is valid for any general compact abelian one
dimensional solenoidal group $\mathbf{S}_G$, which are Pontryagin duals of
dense subgroups $G$ of the rational numbers with the discrete topology. These
solenoidal groups are one-dimensional laminations which are locally
homeomorphic to the product of a Cantor set by an interval so they behave very
much like a ``diffuse'' version of the circle. Our approach differs from others
because we use Pontryagin duality of compact abelian groups to define the
rotation sets.
  \end{abstract}
",Poincar\'e theory for compact abelian one-dimensional solenoidal groups,National Autonomous University of Mexico
52,Alberto Verjovsky,math.AT math.AG,"  We consider a generalized Riemann-Hurwitz formula as it may be applied to
rational maps between projective varieties having an indeterminacy set and
fold-like singularities. The case of a holomorphic branched covering map is
recalled. Then we see how the formula can be applied to iterated maps having
branch-like singularities. Separately, we consider a further application
involving the Chern classes of determinantal varieties when the latter are
realized as the degeneracy loci of certain vector bundle morphisms.
","Rational and iterated maps, degeneracy loci, and the generalized
  Riemann-Hurwitz formula",National Autonomous University of Mexico
53,Alberto Verjovsky,math.GT math.DG,"  Using the rings of Lipschitz and Hurwitz integers $\mathbb{H}(\mathbb{Z})$
and $\mathbb{H}ur(\mathbb{Z})$ in the quaternion division algebra $\mathbb{H}$,
we define several Kleinian discrete subgroups of $PSL(2,\mathbb{H})$
","Quaternionic Kleinian modular groups and arithmetic hyperbolic orbifolds
  over the quaternions",National Autonomous University of Mexico
54,Alberto Verjovsky,math.AT math.GT,"  We construct open book structures on all moment-angle manifolds and describe
the topology of their leaves and bindings under certain restrictions. II. We
also show, using a recent deep result about contact forms due to Borman,
Eliashberg and Murphy [6], that every odd-dimensional moment-angle manifold
admits a contact structure. This contrasts with the fact that, except for a
few, well-determined cases, even-dimensional ones do not admit symplectic
structures. We obtain the same results for large families of more general
intersections of quadrics.
",Some Open Book and Contact Structures on Moment-Angle Manifolds,National Autonomous University of Mexico
55,Alberto Verjovsky,math.CV math.NT,"  Topologically the adelic Riemann sphere is the suspension of the adelic
solenoid and because of this relation, here we study the adelic solenoid by
studying the adelic Riemann sphere topology. The main result is the
Birkhoff-Grothendieck Theorem: A holomorphic vector bundle splits as a sum of
holomorphic line bundles whose Chern character is now a rational number. As a
consequence, the Picard group is isomorphic to the additive group of rational
numbers and the $K$--ring has new elements that factor the tautological class.
",Adelic solenoid I: Structure and topology,National Autonomous University of Mexico
56,Alejandro Rivera,math.PR,"  Let f be a stationary isotropic non-degenerate Gaussian field on R^2. Assume
that f = q * W where q is both C^2 and L^2 and W is the L^2 white noise on R^2.
We extend a result by Stephen Muirhead and Hugo Vanneuville by showing that,
assuming that q * q is pointwise non-negative and has fast enough decay, the
set {f > -l} percolates with probability one when l > 0 and with probability
zero if l < 0 or l = 0. We also prove exponential decay of crossing
probabilities and uniqueness of the unbounded cluster. To this end, we study a
Gaussian field g defined on the torus and establish a superconcentration
formula for the threshold T(g) which is the minimal value such that {g > -T(g)}
contains a non-contractible loop. This formula follows from a Gaussian
Talagrand type inequality.
",Talagrand's inequality in planar Gaussian field percolation,Carnegie Mellon University
57,Alejandro Rivera,math.PR,"  For the Bargmann-Fock field on R d with d $\ge$ 3, we prove that the critical
level c (d) of the percolation model formed by the excursion sets {f $\ge$ } is
strictly positive. This implies that for every sufficiently close to 0 (in
particular for the nodal hypersurfaces corresponding to the case = 0), {f = }
contains an unbounded connected component that visits ""most"" of the ambient
space. Our findings actually hold for a more general class of positively
correlated smooth Gaussian fields with rapid decay of correlations. The results
of this paper show that the behaviour of nodal hypersurfaces of these Gaussian
fields in R d for d $\ge$ 3 is very different from the behaviour of nodal lines
of their two-dimensional analogues. Contents
","Existence of an unbounded nodal hypersurface for smooth Gaussian fields
  in dimension d $\ge$ 3",Carnegie Mellon University
58,Alejandro Rivera,math.PR math.SP,"  Let ($\Sigma$, g) be a closed connected surface equipped with a riemannian
metric. Let ($\lambda$ n) n$\in$N and ($\psi$ n) n$\in$N be the increasing
sequence of eigenvalues and the sequence of corresponding L 2-normalized
eigenfunctions of the laplacian on $\Sigma$. For each L \textgreater{} 0, we
consider $\phi$ L = 0\textless{}$\lambda$n$\le$L $\xi$n $\sqrt$ $\lambda$n
$\psi$ n where the $\xi$ n are i.i.d centered gaussians with variance 1. As L
$\rightarrow$ $\infty$, $\phi$ L converges a.s. to the Gaussian Free Field on
$\Sigma$ in the sense of distributions. We first compute the asymptotic
behavior of the covariance function for this family of fields as L
$\rightarrow$ $\infty$. We then use this result to obtain the asymptotics of
the probability that $\phi$ L is positive on a given open proper subset with
smooth boundary. In doing so, we also prove the concentration of the supremum
of $\phi$ L around 1 $\sqrt$ 2$\pi$ ln L.
",Hole probability for nodal sets of the cut-off Gaussian Free Field,Carnegie Mellon University
